{
  "$schema": "https://json-schema.org/draft/2020-12/schema",
  "$id": "https://opencode-magi.local/schema.json",
  "type": "object",
  "additionalProperties": false,
  "properties": {
    "$schema": { "type": "string" },
    "account": { "type": "string", "minLength": 1 },
    "agents": {
      "type": "object",
      "additionalProperties": false,
      "properties": {
        "permissions": { "$ref": "#/$defs/permissions" },
        "refs": {
          "type": "object",
          "additionalProperties": { "$ref": "#/$defs/agentRef" }
        }
      }
    },
    "clear": {
      "type": "object",
      "additionalProperties": false,
      "properties": {
        "output": { "type": "boolean", "default": true },
        "worktree": { "type": "boolean", "default": true },
        "session": { "type": "boolean", "default": true },
        "branch": { "type": "boolean", "default": true }
      }
    },
    "github": {
      "type": "object",
      "required": ["owner", "repo"],
      "additionalProperties": false,
      "properties": {
        "host": { "type": "string", "default": "github.com" },
        "retryApiAttempts": {
          "type": "integer",
          "minimum": 0,
          "default": 3,
          "description": "Number of retry attempts for GitHub CLI rate limit errors and invalid ZIP cache errors when fetching failed run logs."
        },
        "owner": { "type": "string", "minLength": 1 },
        "repo": { "type": "string", "minLength": 1 },
        "url": { "type": "string" }
      }
    },
    "language": { "type": "string" },
    "merge": { "$ref": "#/$defs/merge" },
    "mode": { "enum": ["multi", "single"], "default": "single" },
    "output": {
      "type": "object",
      "additionalProperties": false,
      "properties": {
        "repairAttempts": { "type": "integer", "minimum": 0, "default": 3 }
      }
    },
    "review": { "$ref": "#/$defs/review" },
    "triage": { "$ref": "#/$defs/triage" }
  },
  "$defs": {
    "agentRef": {
      "type": "object",
      "additionalProperties": false,
      "properties": {
        "id": { "type": "string", "pattern": "^[A-Za-z0-9_-]+$" },
        "model": { "$ref": "#/$defs/modelConfig" },
        "account": { "type": "string", "minLength": 1 },
        "author": {
          "type": "object",
          "additionalProperties": false,
          "properties": {
            "name": { "type": "string", "minLength": 1 },
            "email": { "type": "string", "minLength": 1 }
          }
        },
        "permissions": { "$ref": "#/$defs/permissions" },
        "persona": { "type": "string" }
      }
    },
    "reviewer": {
      "type": "object",
      "if": { "not": { "required": ["ref"] } },
      "then": { "required": ["model"] },
      "additionalProperties": false,
      "properties": {
        "ref": { "type": "string", "minLength": 1 },
        "id": { "type": "string", "pattern": "^[A-Za-z0-9_-]+$" },
        "model": { "$ref": "#/$defs/modelConfig" },
        "account": { "type": "string", "minLength": 1 },
        "permissions": { "$ref": "#/$defs/permissions" },
        "persona": { "type": "string" }
      }
    },
    "editor": {
      "type": "object",
      "if": { "not": { "required": ["ref"] } },
      "then": { "required": ["model", "account", "author"] },
      "additionalProperties": false,
      "properties": {
        "ref": { "type": "string", "minLength": 1 },
        "model": { "$ref": "#/$defs/modelConfig" },
        "account": { "type": "string", "minLength": 1 },
        "author": {
          "type": "object",
          "required": ["name", "email"],
          "additionalProperties": false,
          "properties": {
            "name": { "type": "string", "minLength": 1 },
            "email": { "type": "string", "minLength": 1 }
          }
        },
        "permissions": { "$ref": "#/$defs/permissions" },
        "persona": { "type": "string" }
      }
    },
    "triageAgent": {
      "type": "object",
      "if": { "not": { "required": ["ref"] } },
      "then": { "required": ["model"] },
      "additionalProperties": false,
      "properties": {
        "ref": { "type": "string", "minLength": 1 },
        "id": { "type": "string", "pattern": "^[A-Za-z0-9_-]+$" },
        "model": { "$ref": "#/$defs/modelConfig" },
        "account": { "type": "string", "minLength": 1 },
        "permissions": { "$ref": "#/$defs/permissions" },
        "persona": { "type": "string" }
      }
    },
    "triageCreator": {
      "type": "object",
      "if": { "not": { "required": ["ref"] } },
      "then": { "required": ["model", "author"] },
      "additionalProperties": false,
      "properties": {
        "ref": { "type": "string", "minLength": 1 },
        "account": { "type": "string", "minLength": 1 },
        "model": { "$ref": "#/$defs/modelConfig" },
        "author": {
          "type": "object",
          "required": ["name", "email"],
          "additionalProperties": false,
          "properties": {
            "name": { "type": "string", "minLength": 1 },
            "email": { "type": "string", "minLength": 1 }
          }
        },
        "permissions": { "$ref": "#/$defs/permissions" },
        "persona": { "type": "string" }
      }
    },
    "modelConfig": {
      "oneOf": [
        { "type": "string", "minLength": 1 },
        { "$ref": "#/$defs/modelCandidate" },
        {
          "type": "array",
          "minItems": 1,
          "items": {
            "oneOf": [
              { "type": "string", "minLength": 1 },
              { "$ref": "#/$defs/modelCandidate" }
            ]
          }
        }
      ]
    },
    "modelCandidate": {
      "type": "object",
      "required": ["id"],
      "additionalProperties": false,
      "properties": {
        "id": { "type": "string", "minLength": 1 },
        "variant": { "type": "string" }
      }
    },
    "safetyFilter": {
      "type": "object",
      "additionalProperties": false,
      "minProperties": 1,
      "properties": {
        "exclude": { "type": "array", "items": { "type": "string" } },
        "include": { "type": "array", "items": { "type": "string" } }
      }
    },
    "safetyBranchFilter": {
      "type": "object",
      "additionalProperties": false,
      "minProperties": 1,
      "properties": {
        "base": { "$ref": "#/$defs/safetyFilter" },
        "head": { "$ref": "#/$defs/safetyFilter" }
      }
    },
    "roleFilter": {
      "type": "object",
      "additionalProperties": false,
      "minProperties": 1,
      "properties": {
        "exclude": {
          "type": "array",
          "items": {
            "type": "string",
            "enum": [
              "COLLABORATOR",
              "CONTRIBUTOR",
              "FIRST_TIME_CONTRIBUTOR",
              "FIRST_TIMER",
              "MANNEQUIN",
              "MEMBER",
              "NONE",
              "OWNER"
            ]
          }
        },
        "include": {
          "type": "array",
          "items": {
            "type": "string",
            "enum": [
              "COLLABORATOR",
              "CONTRIBUTOR",
              "FIRST_TIME_CONTRIBUTOR",
              "FIRST_TIMER",
              "MANNEQUIN",
              "MEMBER",
              "NONE",
              "OWNER"
            ]
          }
        }
      }
    },
    "safety": {
      "type": "object",
      "additionalProperties": false,
      "properties": {
        "authors": { "$ref": "#/$defs/safetyFilter" },
        "branches": { "$ref": "#/$defs/safetyBranchFilter" },
        "labels": { "$ref": "#/$defs/safetyFilter" },
        "maxChangedFiles": { "type": "integer", "minimum": 0 },
        "paths": { "$ref": "#/$defs/safetyFilter" },
        "roles": { "$ref": "#/$defs/roleFilter" }
      }
    },
    "conditions": {
      "oneOf": [
        { "type": "boolean" },
        {
          "type": "array",
          "items": {
            "type": "array",
            "minItems": 2,
            "maxItems": 2,
            "prefixItems": [{ "type": "boolean" }, { "$ref": "#/$defs/safety" }]
          }
        }
      ]
    },
    "automationSafety": {
      "type": "object",
      "additionalProperties": false,
      "properties": {
        "authors": { "$ref": "#/$defs/safetyFilter" },
        "branches": { "$ref": "#/$defs/safetyBranchFilter" },
        "labels": { "$ref": "#/$defs/safetyFilter" },
        "paths": { "$ref": "#/$defs/safetyFilter" },
        "roles": { "$ref": "#/$defs/roleFilter" }
      }
    },
    "automationConditions": {
      "oneOf": [
        { "type": "boolean" },
        {
          "type": "array",
          "items": {
            "type": "array",
            "minItems": 2,
            "maxItems": 2,
            "prefixItems": [
              { "type": "boolean" },
              { "$ref": "#/$defs/automationSafety" }
            ]
          }
        }
      ]
    },
    "mergeAutomationConditions": {
      "oneOf": [
        { "type": "boolean" },
        {
          "type": "array",
          "items": {
            "type": "array",
            "minItems": 2,
            "maxItems": 2,
            "prefixItems": [
              { "type": "boolean" },
              { "$ref": "#/$defs/mergeAutomationSafety" }
            ]
          }
        }
      ]
    },
    "mergeAutomationSafety": {
      "type": "object",
      "additionalProperties": false,
      "properties": {
        "authors": { "$ref": "#/$defs/safetyFilter" },
        "branches": { "$ref": "#/$defs/safetyBranchFilter" },
        "edited": { "type": "boolean" },
        "labels": { "$ref": "#/$defs/safetyFilter" },
        "paths": { "$ref": "#/$defs/safetyFilter" },
        "roles": { "$ref": "#/$defs/roleFilter" }
      }
    },
    "automation": {
      "type": "object",
      "additionalProperties": false,
      "properties": {
        "merge": { "$ref": "#/$defs/automationConditions", "default": true },
        "close": { "$ref": "#/$defs/automationConditions", "default": false }
      }
    },
    "mergeAutomation": {
      "type": "object",
      "additionalProperties": false,
      "properties": {
        "merge": {
          "$ref": "#/$defs/mergeAutomationConditions",
          "default": true
        },
        "close": {
          "$ref": "#/$defs/mergeAutomationConditions",
          "default": false
        },
        "conflict": { "$ref": "#/$defs/automationConditions", "default": false }
      }
    },
    "reviewChecks": {
      "type": "object",
      "additionalProperties": false,
      "properties": {
        "exclude": { "type": "array", "items": { "type": "string" } },
        "wait": { "type": "boolean", "default": true },
        "retryFailedJobs": { "type": "integer", "minimum": 0, "default": 3 }
      }
    },
    "mergeChecks": {
      "type": "object",
      "additionalProperties": false,
      "properties": {
        "wait": { "type": "boolean", "default": true }
      }
    },
    "concurrency": {
      "type": "object",
      "additionalProperties": false,
      "properties": {
        "runs": { "type": "integer", "minimum": 1, "default": 3 },
        "reviewers": { "type": "integer", "minimum": 1, "default": 3 }
      }
    },
    "triageConcurrency": {
      "type": "object",
      "additionalProperties": false,
      "properties": {
        "runs": { "type": "integer", "minimum": 1, "default": 3 }
      }
    },
    "reviewPrompts": {
      "type": "object",
      "additionalProperties": false,
      "properties": {
        "review": { "type": "string" },
        "rereview": { "type": "string" },
        "reviewGuidelines": { "type": "string" },
        "ciClassification": { "type": "string" },
        "findingValidation": { "type": "string" },
        "closeReconsideration": { "type": "string" }
      }
    },
    "mergePrompts": {
      "type": "object",
      "additionalProperties": false,
      "properties": {
        "edit": { "type": "string" },
        "editGuidelines": { "type": "string" },
        "ciClassification": { "type": "string" }
      }
    },
    "triagePrompts": {
      "type": "object",
      "additionalProperties": false,
      "properties": {
        "existingPr": { "type": "string" },
        "duplicate": { "type": "string" },
        "category": { "type": "string" },
        "acceptance": { "type": "string" },
        "commentClassification": { "type": "string" },
        "reconsider": { "type": "string" },
        "create": { "type": "string" },
        "createGuidelines": { "type": "string" }
      }
    },
    "triageCategory": {
      "type": "object",
      "additionalProperties": false,
      "required": ["id"],
      "properties": {
        "id": {
          "type": "string",
          "pattern": "^[A-Za-z0-9_-]+$",
          "not": { "enum": ["ASK", "none"] }
        },
        "labels": { "type": "array", "items": { "type": "string" } },
        "types": { "type": "array", "items": { "type": "string" } },
        "description": { "type": "string" }
      }
    },
    "triageSignal": {
      "type": "object",
      "additionalProperties": false,
      "required": ["id", "description"],
      "properties": {
        "id": { "type": "string", "pattern": "^[A-Za-z0-9_-]+$" },
        "description": { "type": "string", "minLength": 1 }
      }
    },
    "triageLabelRuleCondition": {
      "type": "object",
      "additionalProperties": false,
      "minProperties": 1,
      "properties": {
        "disposition": {
          "enum": [
            "accepted",
            "rejected",
            "invalid",
            "duplicate",
            "already_handled",
            "needs_category",
            "needs_acceptance",
            "blocked",
            "failed"
          ]
        },
        "category": { "type": "string" },
        "signals": { "type": "array", "items": { "type": "string" } }
      }
    },
    "triageLabelRule": {
      "type": "object",
      "additionalProperties": false,
      "required": ["when"],
      "properties": {
        "when": { "$ref": "#/$defs/triageLabelRuleCondition" },
        "add": { "type": "array", "items": { "type": "string" } },
        "remove": { "type": "array", "items": { "type": "string" } }
      }
    },
    "triageAutomation": {
      "type": "object",
      "additionalProperties": false,
      "properties": {
        "close": { "type": "boolean", "default": false },
        "create": { "type": "boolean", "default": false },
        "review": { "type": "boolean", "default": false },
        "merge": { "type": "boolean", "default": false },
        "label": {
          "type": "array",
          "items": { "$ref": "#/$defs/triageLabelRule" }
        }
      }
    },
    "triageSafety": {
      "type": "object",
      "additionalProperties": false,
      "properties": {
        "requiredLabels": { "type": "array", "items": { "type": "string" } },
        "blockedLabels": { "type": "array", "items": { "type": "string" } },
        "allowAuthors": { "type": "array", "items": { "type": "string" } },
        "allowMentionActors": {
          "type": "array",
          "items": { "type": "string" }
        },
        "allowMentionRoles": { "type": "array", "items": { "type": "string" } }
      }
    },
    "reviewMerge": {
      "type": "object",
      "additionalProperties": false,
      "properties": {
        "approvalPolicy": {
          "enum": ["majority", "unanimous"],
          "default": "majority"
        },
        "method": { "enum": ["merge", "squash", "rebase"] },
        "auto": { "type": "boolean" },
        "deleteBranch": { "type": "boolean" },
        "queue": { "type": "boolean", "default": false }
      }
    },
    "review": {
      "type": "object",
      "additionalProperties": false,
      "properties": {
        "reviewers": {
          "type": "array",
          "minItems": 3,
          "items": { "$ref": "#/$defs/reviewer" }
        },
        "prompts": { "$ref": "#/$defs/reviewPrompts" },
        "checks": { "$ref": "#/$defs/reviewChecks" },
        "safety": { "$ref": "#/$defs/conditions" },
        "automation": { "$ref": "#/$defs/automation" },
        "concurrency": { "$ref": "#/$defs/concurrency" },
        "merge": { "$ref": "#/$defs/reviewMerge" },
        "operator": { "type": "string", "minLength": 1 },
        "output": { "type": "string" },
        "worktree": { "type": "string" }
      }
    },
    "merge": {
      "type": "object",
      "additionalProperties": false,
      "properties": {
        "editor": { "$ref": "#/$defs/editor" },
        "checks": { "$ref": "#/$defs/mergeChecks" },
        "prompts": { "$ref": "#/$defs/mergePrompts" },
        "automation": { "$ref": "#/$defs/mergeAutomation" },
        "maxThreadResolutionCycles": {
          "type": "integer",
          "minimum": 0,
          "default": 5,
          "description": "Maximum resolution attempts per unresolved review thread. Set 0 for unlimited attempts."
        }
      }
    },
    "triage": {
      "type": "object",
      "additionalProperties": false,
      "properties": {
        "voters": {
          "type": "array",
          "minItems": 3,
          "items": { "$ref": "#/$defs/triageAgent" }
        },
        "creator": { "$ref": "#/$defs/triageCreator" },
        "categories": {
          "type": "array",
          "items": { "$ref": "#/$defs/triageCategory" }
        },
        "signals": {
          "type": "array",
          "items": { "$ref": "#/$defs/triageSignal" }
        },
        "automation": { "$ref": "#/$defs/triageAutomation" },
        "safety": { "$ref": "#/$defs/triageSafety" },
        "concurrency": { "$ref": "#/$defs/triageConcurrency" },
        "prompts": { "$ref": "#/$defs/triagePrompts" },
        "operator": { "type": "string", "minLength": 1 },
        "output": { "type": "string" },
        "worktree": { "type": "string" }
      }
    },
    "permissionAction": { "enum": ["allow", "ask", "deny"] },
    "permissionRule": {
      "oneOf": [
        { "$ref": "#/$defs/permissionAction" },
        {
          "type": "object",
          "additionalProperties": { "$ref": "#/$defs/permissionAction" }
        }
      ]
    },
    "permissions": {
      "oneOf": [
        { "$ref": "#/$defs/permissionAction" },
        {
          "type": "object",
          "additionalProperties": { "$ref": "#/$defs/permissionRule" }
        }
      ]
    }
  }
}
